http://books.toscrape.com/catalogue/paper-girls-vol-1-paper-girls-1-5_44/index.html,bcbcbcf0f6ed196f,"Paper Girls, Vol. 1 (Paper Girls #1-5)",£21.71,£21.71,In stock (1 available),"In the early hours after Halloween of 1988, four 12-year-old newspaper delivery girls uncover the most important story of all time. Suburban drama and otherworldly mysteries collide in this smash-hit series about nostalgia, first jobs, and the last days of childhood.Collects Paper Girls #1-5.",Sequential Art,Four star(s),http://books.toscrape.com/media/cache/87/b3/87b3b5ff42301d1c7eeb0c81055f1633.jpg
http://books.toscrape.com/catalogue/ouran-high-school-host-club-vol-1-ouran-high-school-host-club-1_43/index.html,326825e02a198cf6,"Ouran High School Host Club, Vol. 1 (Ouran High School Host Club #1)",£29.87,£29.87,In stock (1 available),"One day, Haruhi, a scholarship student at exclusive Ouran High School, breaks an $80,000 vase that belongs to the 'Host Club', a mysterious campus group consisting of six super-rich (and gorgeous) guys. To pay back the damages, she is forced to work for the club, and it's there that she discovers just how wealthy the boys are and how different they are from everybody else.",Sequential Art,Three star(s),http://books.toscrape.com/media/cache/27/33/27334267037a79caed4d7b0092d59fb5.jpg
http://books.toscrape.com/catalogue/ms-marvel-vol-1-no-normal-ms-marvel-2014-2015-1_34/index.html,35a60467893aa168,"Ms. Marvel, Vol. 1: No Normal (Ms. Marvel (2014-2015) #1)",£39.39,£39.39,In stock (1 available),"Marvel Comics presents the new Ms. Marvel, the groundbreaking heroine that has become an international sensation! Kamala Khan is an ordinary girl from Jersey City — until she's suddenly empowered with extraordinary gifts. But who truly is the new Ms. Marvel? Teenager? Muslim? Inhuman? Find out as she takes the Marvel Universe by storm! When Kamala discovers the dangers of Marvel Comics presents the new Ms. Marvel, the groundbreaking heroine that has become an international sensation! Kamala Khan is an ordinary girl from Jersey City — until she's suddenly empowered with extraordinary gifts. But who truly is the new Ms. Marvel? Teenager? Muslim? Inhuman? Find out as she takes the Marvel Universe by storm! When Kamala discovers the dangers of her newfound powers, she unlocks a secret behind them, as well. Is Kamala ready to wield these immense new gifts? Or will the weight of the legacy before her be too much to bear? Kamala has no idea, either. But she's comin' for you, Jersey! It's history in the making from acclaimed writer G. Willow Wilson (Air, Cairo) and beloved artist Adrian Alphona (RUNAWAYS)! Collecting MS. MARVEL (2014) #1-5 and material from ALL-NEW MARVEL NOW! POINT ONE #1. ...more",Sequential Art,Four star(s),http://books.toscrape.com/media/cache/99/f5/99f511d2d38ef356701341d405a1cca2.jpg
http://books.toscrape.com/catalogue/hawkeye-vol-1-my-life-as-a-weapon-hawkeye-1_24/index.html,6fe02600f322a0a9,"Hawkeye, Vol. 1: My Life as a Weapon (Hawkeye #1)",£45.24,£45.24,In stock (1 available),"The breakout star of this summer's blockbuster Avengers film, Clint Barton - aka the self-made hero Hawkeye - fights for justice! With ex-Young Avenger Kate Bishop by his side, he's out to prove himself as one of Earth's Mightiest Heroes! SHIELD recruits Clint to intercept a packet of incriminating evidence - before he becomes the most wanted man in the world. You won't be The breakout star of this summer's blockbuster Avengers film, Clint Barton - aka the self-made hero Hawkeye - fights for justice! With ex-Young Avenger Kate Bishop by his side, he's out to prove himself as one of Earth's Mightiest Heroes! SHIELD recruits Clint to intercept a packet of incriminating evidence - before he becomes the most wanted man in the world. You won't believe what is on The Tape! What is the Vagabond Code? Matt Fraction pens a Hawkeye thriller that spans the globe...and the darkest parts of Hawkeye's mind. Barton and Bishop mean double the Hawkeye and double the trouble...and stealing from the rich never looked so good.COLLECTING: Hawkeye 1-5, Young Avengers Presents 6 ...more",Sequential Art,Three star(s),http://books.toscrape.com/media/cache/66/97/6697a03eedbac77c2e957788e48b70a8.jpg
http://books.toscrape.com/catalogue/giant-days-vol-1-giant-days-1-4_22/index.html,eb0fe24bbc845ecc,"Giant Days, Vol. 1 (Giant Days #1-4)",£56.76,£56.76,In stock (1 available),"Susan, Esther, and Daisy started at university three weeks ago and became fast friends. Now, away from home for the first time, all three want to reinvent themselves. But in the face of handwringing boys, “personal experimentation,” influenza, mystery mold, nuchauvinism, and the willful, unwanted intrusion of “academia,” they may be lucky just to make it to spring alive. C Susan, Esther, and Daisy started at university three weeks ago and became fast friends. Now, away from home for the first time, all three want to reinvent themselves. But in the face of handwringing boys, “personal experimentation,” influenza, mystery mold, nuchauvinism, and the willful, unwanted intrusion of “academia,” they may be lucky just to make it to spring alive. Collects issues #1-4. ...more",Sequential Art,Four star(s),http://books.toscrape.com/media/cache/eb/20/eb2063bd8d636cb8200c4b2c7cb6c773.jpg
http://books.toscrape.com/catalogue/fruits-basket-vol-1-fruits-basket-1_21/index.html,72e6fbf4f6382557,"Fruits Basket, Vol. 1 (Fruits Basket #1)",£40.28,£40.28,In stock (1 available),A family with an ancient curse...And the girl who will change their lives forever...Tohru Honda was an orphan with no place to go until the mysterious Sohma family offered her a place to call home. Now her ordinary high school life is turned upside down as she's introduced to the Sohma's world of magical curses and family secrets.,Sequential Art,Five star(s),http://books.toscrape.com/media/cache/03/c5/03c51e2b5bf51a3f55deecbf8c9e8515.jpg
http://books.toscrape.com/catalogue/bleach-vol-1-strawberry-and-the-soul-reapers-bleach-1_7/index.html,099fae4a0705d63b,"Bleach, Vol. 1: Strawberry and the Soul Reapers (Bleach #1)",£34.65,£34.65,In stock (1 available),"Hot-tempered 15-year-old Ichigo Kurosaki, the hero of the popular fantasy-adventure Bleach , has the unsettling ability to see spirits who are unable to rest in peace. His sixth sense leads him to Rukia, a Soul Reaper who destroys Hollows (soul-devouring monsters) and ensures the deceased find repose with the Soul Society. When she's injured in battle, Rukia transfers h Hot-tempered 15-year-old Ichigo Kurosaki, the hero of the popular fantasy-adventure Bleach , has the unsettling ability to see spirits who are unable to rest in peace. His sixth sense leads him to Rukia, a Soul Reaper who destroys Hollows (soul-devouring monsters) and ensures the deceased find repose with the Soul Society. When she's injured in battle, Rukia transfers her sword and much of her power to Ichigo, whose spiritual energy makes him a formidable substitute Soul Reaper. But the orange-haired teenager isn't sure he wants the job: too many risks and moral dilemmas. ...more",Sequential Art,Five star(s),http://books.toscrape.com/media/cache/48/b0/48b07e2daa02d7e5485aa546dec5a25e.jpg
http://books.toscrape.com/catalogue/ajin-demi-human-volume-1-ajin-demi-human-1_4/index.html,bfd5e1701c862ac3,"Ajin: Demi-Human, Volume 1 (Ajin: Demi-Human #1)",£57.06,£57.06,In stock (1 available),"High school student Kei Nagai is struck dead in a grizzly traffic accident, but immediately revives to learn that he may not be like every other human. Instead, he may be a mysterious almost immortal being granted not only the powers of rejuvination but the abilities to see super-natural beings. Scared, he runs away, and is aided in his escape from society by his friend. U High school student Kei Nagai is struck dead in a grizzly traffic accident, but immediately revives to learn that he may not be like every other human. Instead, he may be a mysterious almost immortal being granted not only the powers of rejuvination but the abilities to see super-natural beings. Scared, he runs away, and is aided in his escape from society by his friend. Unfortunately for Kei, the manhunt is on and he will soon be caught within a conflict between mankind and others like him as they prepare to fight a new war based on terror. ...more",Sequential Art,Four star(s),http://books.toscrape.com/media/cache/30/98/309814b6eeba469f4c741147aaaa076a.jpg
