http://books.toscrape.com/catalogue/the-sandman-vol-3-dream-country-the-sandman-volumes-3_279/index.html,91eb9605998a7c03,"The Sandman, Vol. 3: Dream Country (The Sandman (volumes) #3)",£55.55,£55.55,In stock (3 available),"The third volume of the Sandman collection is a series of four short comic book stories. In each of these otherwise unrelated stories, Morpheus serves only as a minor character. Here we meet the mother of Morpheus's son, find out what cats dream about, and discover the true origin behind Shakespeare's A Midsummer's Night Dream. The latter won a World Fantasy Award for best The third volume of the Sandman collection is a series of four short comic book stories. In each of these otherwise unrelated stories, Morpheus serves only as a minor character. Here we meet the mother of Morpheus's son, find out what cats dream about, and discover the true origin behind Shakespeare's A Midsummer's Night Dream. The latter won a World Fantasy Award for best short story, the first time a comic book was given that honor. collecting The Sandman #17–20 ...more",Sequential Art,Five star(s),http://books.toscrape.com/media/cache/df/96/df96b9a9739d2421620bfb3622f3c2d0.jpg
http://books.toscrape.com/catalogue/saga-volume-3-saga-collected-editions-3_216/index.html,7b870bf85d01c2dc,"Saga, Volume 3 (Saga (Collected Editions) #3)",£21.57,£21.57,In stock (3 available),"From the Hugo Award-winning duo of Brian K. Vaughan (The Private Eye, Y: The Last Man) and Fiona Staples (North 40, Red Sonja), Saga is the sweeping tale of one young family fighting to find their place in the universe. Searching for their literary hero, new parents Marko and Alana travel to a cosmic lighthouse on the planet Quietus, while the couple's multiple pursuers fi From the Hugo Award-winning duo of Brian K. Vaughan (The Private Eye, Y: The Last Man) and Fiona Staples (North 40, Red Sonja), Saga is the sweeping tale of one young family fighting to find their place in the universe. Searching for their literary hero, new parents Marko and Alana travel to a cosmic lighthouse on the planet Quietus, while the couple's multiple pursuers finally close in on their targets.Collects issues 13-18. ...more",Sequential Art,Five star(s),http://books.toscrape.com/media/cache/55/89/5589eb7a8127d04add1c4205186d91d4.jpg
http://books.toscrape.com/catalogue/prodigy-the-graphic-novel-legend-the-graphic-novel-2_207/index.html,9707989a439757b4,Prodigy: The Graphic Novel (Legend: The Graphic Novel #2),£43.63,£43.63,In stock (3 available),"The second book in the best-selling Legend trilogy comes to life in this vibrant graphic novel adaptation.After escaping from the Republic's stronghold, Day and June are on the run in Vegas when the country learns that their Elector Primo has died and his son has stepped in to take his place. They meet up with the rebel stronghold of the Patriots—a large organization strad The second book in the best-selling Legend trilogy comes to life in this vibrant graphic novel adaptation.After escaping from the Republic's stronghold, Day and June are on the run in Vegas when the country learns that their Elector Primo has died and his son has stepped in to take his place. They meet up with the rebel stronghold of the Patriots—a large organization straddling the line between the Republic and its warring neighbor, the Colonies—and learn about an assassination plot against the Elector. Using threats and blackmail to get what he wants, the Patriots' leader, Razor, convinces June to let herself be captured by Republic soldiers so she can win over the Elector and feed him a decoy assassination plan. But when June realizes that the new Elector is nothing like his father, she must work with Day to try to stop the Patriots' plot before Razor can fulfill his own devastating plans. ...more",Sequential Art,Three star(s),http://books.toscrape.com/media/cache/1b/8b/1b8b733db667fc3a7bbca0d65fa078f1.jpg
http://books.toscrape.com/catalogue/persepolis-the-story-of-a-childhood-persepolis-1-2_206/index.html,cb62418129b864a3,Persepolis: The Story of a Childhood (Persepolis #1-2),£39.13,£39.13,In stock (3 available),"A New York Times Notable BookA Time Magazine “Best Comix of the Year”A San Francisco Chronicle and Los Angeles Times Best-sellerWise, funny, and heartbreaking, Persepolis is Marjane Satrapi’s memoir of growing up in Iran during the Islamic Revolution. In powerful black-and-white comic strip images, Satrapi tells the story of her life in Tehran from ages six to fourteen, ye A New York Times Notable BookA Time Magazine “Best Comix of the Year”A San Francisco Chronicle and Los Angeles Times Best-sellerWise, funny, and heartbreaking, Persepolis is Marjane Satrapi’s memoir of growing up in Iran during the Islamic Revolution. In powerful black-and-white comic strip images, Satrapi tells the story of her life in Tehran from ages six to fourteen, years that saw the overthrow of the Shah’s regime, the triumph of the Islamic Revolution, and the devastating effects of war with Iraq. The intelligent and outspoken only child of committed Marxists and the great-granddaughter of one of Iran’s last emperors, Marjane bears witness to a childhood uniquely entwined with the history of her country.Persepolis paints an unforgettable portrait of daily life in Iran and of the bewildering contradictions between home life and public life. Marjane’s child’s-eye view of dethroned emperors, state-sanctioned whippings, and heroes of the revolution allows us to learn as she does the history of this fascinating country and of her own extraordinary family. Intensely personal, profoundly political, and wholly original, Persepolis is at once a story of growing up and a reminder of the human cost of war and political repression. It shows how we carry on, with laughter and tears, in the face of absurdity. And, finally, it introduces us to an irresistible little girl with whom we cannot help but fall in love. ...more",Sequential Art,One star(s),http://books.toscrape.com/media/cache/9d/5f/9d5f4a231a2ee898ed76f603b3e40163.jpg
http://books.toscrape.com/catalogue/original-fake_203/index.html,c59283b05905c853,Original Fake,£31.45,£31.45,In stock (3 available),"In this Banksy-inspired illustrated novel, an escalating sibling rivalry train wrecks and vengeance is a street-art act of warIntrovert Frankie Neumann hates his life, and understandably so. He’s got a weird, tutu-wearing sister, Lou, and even weirder parents, Bridget and Brett—Frank Sinatra and Dr. Frank-N-Furter impersonators, respectively. And, he’s just the guy who mak In this Banksy-inspired illustrated novel, an escalating sibling rivalry train wrecks and vengeance is a street-art act of warIntrovert Frankie Neumann hates his life, and understandably so. He’s got a weird, tutu-wearing sister, Lou, and even weirder parents, Bridget and Brett—Frank Sinatra and Dr. Frank-N-Furter impersonators, respectively. And, he’s just the guy who makes pizza at Pizza Vendetta. Though he has secret artistic aspirations of his own, his over-the-top family makes him want to stay in the background. But Frankie's life is about to change—becoming way more interesting, even a little dangerous, but definitely cool.After his shift at the pizzeria one night, Frankie meets David and Rory, cousins and errand runners for the mysterious Uncle Epic, a legendary anonymous street artist and Frankie’s absolute idol. Little could Frankie dream that his new adventures with Uncle Epic would lead to the perfect opportunity to strike back at his insufferable sister for a lifetime of torture. But things go haywire quicker than you can say “street art kicks righteous ass,” and the lines are suddenly blurred between art and Frankie’s real life. ...more",Sequential Art,Three star(s),http://books.toscrape.com/media/cache/39/99/3999845b6800427aad3d45041586a171.jpg
http://books.toscrape.com/catalogue/grayson-vol-3-nemesis-grayson-3_164/index.html,4f6985aca357ae09,"Grayson, Vol 3: Nemesis (Grayson #3)",£42.72,£42.72,In stock (3 available),"In this collection, Grayson faces some of his most difficult challenges! Not only must he take on Lex Luthor, and risks losing his position with Spyral, but Dick finds that in order to save Agent 1 he must face off with... himself! And who is the mysterious shadow leader behind Spyral, and what does he want with Dick? The super-spy finds himself in a clandestine hunt for t In this collection, Grayson faces some of his most difficult challenges! Not only must he take on Lex Luthor, and risks losing his position with Spyral, but Dick finds that in order to save Agent 1 he must face off with... himself! And who is the mysterious shadow leader behind Spyral, and what does he want with Dick? The super-spy finds himself in a clandestine hunt for the true identity of Agent Zero!Collecting Grayson 10-14 ...more",Sequential Art,One star(s),http://books.toscrape.com/media/cache/a9/10/a9105d5dbdc6a339c21d6635b3dc1697.jpg
http://books.toscrape.com/catalogue/fruits-basket-vol-3-fruits-basket-3_159/index.html,d5f5a122a593b580,"Fruits Basket, Vol. 3 (Fruits Basket #3)",£45.17,£45.17,In stock (3 available),"A family with an ancient curse...And the girl who will change their lives forever...It's Valentines Day and you know what that means - lots of chocolates for the cutest boys at school! In this case, it's a pretty close tie between hot-headed Kyo Sohma and ""Prince Charming"" Yuki Sohma. Of course the kind-hearted Tohru, guest of the Sohma family, has chocolates for everyone! A family with an ancient curse...And the girl who will change their lives forever...It's Valentines Day and you know what that means - lots of chocolates for the cutest boys at school! In this case, it's a pretty close tie between hot-headed Kyo Sohma and ""Prince Charming"" Yuki Sohma. Of course the kind-hearted Tohru, guest of the Sohma family, has chocolates for everyone! But when White Day comes around, what will the Sohma family give her in return? ...more",Sequential Art,Two star(s),http://books.toscrape.com/media/cache/85/d2/85d2821dbc2d274f516582449199015e.jpg
http://books.toscrape.com/catalogue/black-butler-vol-1-black-butler-1_130/index.html,15f415d436888b2d,"Black Butler, Vol. 1 (Black Butler #1)",£49.31,£49.31,In stock (3 available),"In the Victorian ages of London The Earl of the Phantomhive house, Ciel Phantomhive, needs to get his revenge on those who had humiliated him and destroyed what he loved. Not being able to do it alone he sells his soul to a demon he names Sebastian Michaelis. Now working as his butler, Sebastian must help the Earl Phantomhive in this suspenseful, exciting, thriller manga.",Sequential Art,One star(s),http://books.toscrape.com/media/cache/86/bb/86bb13ef73474e6e96acea6e5ff44231.jpg
http://books.toscrape.com/catalogue/awkward_124/index.html,1d89a2aa9f6ce50f,Awkward,£38.02,£38.02,In stock (3 available),"Cardinal rule #1 for surviving school: Don't get noticed by the mean kids.Cardinal rule #2 for surviving school: Seek out groups with similar interests and join them.On her first day at her new school, Penelope--Peppi--Torres reminds herself of these basics. But when she trips into a quiet boy in the hall, Jaime Thompson, she's already broken the first rule, and the mean k Cardinal rule #1 for surviving school: Don't get noticed by the mean kids.Cardinal rule #2 for surviving school: Seek out groups with similar interests and join them.On her first day at her new school, Penelope--Peppi--Torres reminds herself of these basics. But when she trips into a quiet boy in the hall, Jaime Thompson, she's already broken the first rule, and the mean kids start calling her the ""nerder girlfriend."" How does she handle this crisis? By shoving poor Jaime and running away!Falling back on rule two and surrounding herself with new friends in the art club, Peppi still can't help feeling ashamed about the way she treated Jaime. Things are already awkward enough between the two, but to make matters worse, he's a member of her own club's archrivals--the science club! And when the two clubs go to war, Peppi realizes that sometimes you have to break the rules to survive middle school! ...more",Sequential Art,Two star(s),http://books.toscrape.com/media/cache/71/82/718278fb0edaa50e1f1930cdd2048d87.jpg
http://books.toscrape.com/catalogue/the-sandman-vol-2-the-dolls-house-the-sandman-volumes-2_110/index.html,276dc716b1da8899,"The Sandman, Vol. 2: The Doll's House (The Sandman (volumes) #2)",£54.81,£54.81,In stock (2 available),"A being who has existed since the beginning of the universe, Dream of the Endless rules over the realm of dreams. In THE DOLL’S HOUSE, after a decades-long imprisonment, the Sandman has returned to find that a few dreams and nightmares have escaped to reality. Looking to recapture his lost possessions, Morpheus ventures to the human plane only to learn that a woman named R A being who has existed since the beginning of the universe, Dream of the Endless rules over the realm of dreams. In THE DOLL’S HOUSE, after a decades-long imprisonment, the Sandman has returned to find that a few dreams and nightmares have escaped to reality. Looking to recapture his lost possessions, Morpheus ventures to the human plane only to learn that a woman named Rose Walker has inadvertently become a dream vortex and threatens to rip apart his world. Now as Morpheus takes on the last escaped nightmare at a serial killers convention, the Lord of Dreams must mercilessly murder Rose or risk the destruction of his entire kingdom.Collecting issues #9-16, this new edition of THE DOLL’S HOUSE features the improved production values and coloring from the Absolute Edition. ...more",Sequential Art,One star(s),http://books.toscrape.com/media/cache/b3/48/b3481a7849a7d98131ced57476bb2f26.jpg
http://books.toscrape.com/catalogue/saga-volume-2-saga-collected-editions-2_107/index.html,9189fd009df41d0e,"Saga, Volume 2 (Saga (Collected Editions) #2)",£11.75,£11.75,In stock (2 available),"From award-winning writer BRIAN K. VAUGHAN (Pride of Baghdad, Ex Machina) and critically acclaimed artist FIONA STAPLES (Mystery Society, Done to Death), SAGA is sweeping tale of one young family fighting to find their place in the universe. Thanks to her star-crossed parents Marko and Alana, newborn baby Hazel has already survived lethal assassins, rampaging armies, and h From award-winning writer BRIAN K. VAUGHAN (Pride of Baghdad, Ex Machina) and critically acclaimed artist FIONA STAPLES (Mystery Society, Done to Death), SAGA is sweeping tale of one young family fighting to find their place in the universe. Thanks to her star-crossed parents Marko and Alana, newborn baby Hazel has already survived lethal assassins, rampaging armies, and horrific monsters, but in the cold vastness of outer space, the little girl encounters her strangest adventure yet... grandparents.Collects Saga issues #7-12 ...more",Sequential Art,Three star(s),http://books.toscrape.com/media/cache/bd/1e/bd1e9e86b838676121bc4954ab40712a.jpg
http://books.toscrape.com/catalogue/fruits-basket-vol-2-fruits-basket-2_100/index.html,c0db71f6bb14db11,"Fruits Basket, Vol. 2 (Fruits Basket #2)",£11.64,£11.64,In stock (2 available),"A family with an ancient curse...And the girl who will change their lives forever...Ever since Tohru Honda discovered the Zodiac secret of the Sohma clan, her eyes have opened to a world of magic and wonder. But with such a great secret comes great responsibility. When her best friends Hana-chan and Uo-chan come to the Sohma home for a sleepover, Tohru has her work cut out A family with an ancient curse...And the girl who will change their lives forever...Ever since Tohru Honda discovered the Zodiac secret of the Sohma clan, her eyes have opened to a world of magic and wonder. But with such a great secret comes great responsibility. When her best friends Hana-chan and Uo-chan come to the Sohma home for a sleepover, Tohru has her work cut out for her keeping the ""Cat"" in the bag and the ""Dog"" on a leash. ...more",Sequential Art,Five star(s),http://books.toscrape.com/media/cache/87/36/8736be56d958f5d8d855108afb206c9f.jpg
http://books.toscrape.com/catalogue/y-the-last-man-vol-1-unmanned-y-the-last-man-1_98/index.html,09d26b5f819c6a36,"Y: The Last Man, Vol. 1: Unmanned (Y: The Last Man #1)",£18.51,£18.51,In stock (1 available),"""Y"" is none other than unemployed escape artist Yorick Brown (his father was a Shakespeare buff), and he's seemingly the only male human left alive after a mysterious plague kills all Y-chromosome carriers on earth. But why are he and his faithful companion, the often testy male monkey Ampersand, still alive? He sets out to find the answer (and his girlfriend), while runni ""Y"" is none other than unemployed escape artist Yorick Brown (his father was a Shakespeare buff), and he's seemingly the only male human left alive after a mysterious plague kills all Y-chromosome carriers on earth. But why are he and his faithful companion, the often testy male monkey Ampersand, still alive? He sets out to find the answer (and his girlfriend), while running from angry female Republicans (now running the government), Amazon wannabes that include his own sister (seemingly brainwashed), and other threats. The Vertigo team of Brian K. Vaughan, Pia Guerra, and José Marzán Jr. have given us a great read!Collects Y: The Last Man issues #01-#05 ...more",Sequential Art,Four star(s),http://books.toscrape.com/media/cache/31/3f/313fb7d006c8c507d63ce7e96b56d925.jpg
http://books.toscrape.com/catalogue/the-wicked-the-divine-vol-1-the-faust-act-the-wicked-the-divine_86/index.html,dac9d1e654fac737,"The Wicked + The Divine, Vol. 1: The Faust Act (The Wicked + The Divine)",£36.52,£36.52,In stock (1 available),"Every ninety years, twelve gods incarnate as humans. They are loved. They are hated. In two years, they are dead. The team behind critical tongue-attractors like Young Avengers and PHONOGRAM reunite to create a world where gods are the ultimate pop stars and pop stars are the ultimate gods. But remember: just because you’re immortal, doesn’t mean you’re going to live forev Every ninety years, twelve gods incarnate as humans. They are loved. They are hated. In two years, they are dead. The team behind critical tongue-attractors like Young Avengers and PHONOGRAM reunite to create a world where gods are the ultimate pop stars and pop stars are the ultimate gods. But remember: just because you’re immortal, doesn’t mean you’re going to live forever. Collects THE WICKED + THE DIVINE #1-5 ...more",Sequential Art,Two star(s),http://books.toscrape.com/media/cache/2a/29/2a296946d7a2ed3829e57d6b155be43b.jpg
http://books.toscrape.com/catalogue/the-sandman-vol-1-preludes-and-nocturnes-the-sandman-volumes-1_79/index.html,5faefdc861684eb1,"The Sandman, Vol. 1: Preludes and Nocturnes (The Sandman (volumes) #1)",£54.12,£54.12,In stock (1 available),"In 1916, Dream is captured and encased in a glass globe in a failed attempt by a fictional Edwardian magician (very much in the vein of Aleister Crowley) named Roderick Burgess to bind Death and attain immortality. Dream bides his time for decades until Burgess dies. Afterwards, his son Alexander becomes Dream's new captor. Finally, in 1988, Alex's guards grow careless and In 1916, Dream is captured and encased in a glass globe in a failed attempt by a fictional Edwardian magician (very much in the vein of Aleister Crowley) named Roderick Burgess to bind Death and attain immortality. Dream bides his time for decades until Burgess dies. Afterwards, his son Alexander becomes Dream's new captor. Finally, in 1988, Alex's guards grow careless and the guards watching him fall asleep in his presence, allowing Dream to use the sand from their dream to his benefit. When the guards awake and break the seal Dream was in, he is then able to escape. Dream punishes Alex by cursing him to experience an unending series of nightmares. The rest of the story concerns Dream's quest to recover his totems of power, which were dispersed following his capture: a pouch of sand, a helm and a ruby. The pouch is being kept by a former girlfriend of John Constantine's. Once that is recovered, Dream travels to hell to regain the helm from a demon, where he incurs the wrath of Lucifer (an enmity that will have major repercussions later in the series). The ruby is in the possession of John Dee, a.k.a. Doctor Destiny, a supervillain from the Justice League of America series. He has warped and corrupted the ruby, rendering Dream unable to use it, and with it he nearly tears apart the Dreaming. However, thinking that it will kill Dream, Dee shatters the ruby, inadvertently releasing the power that Dream had stored in the ruby and restoring Dream to his full power. The collection ends with ""The Sound of Her Wings"", an epilogue to the first story-arc. This issue introduces a character who has become one of the series' most popular and prominent personalities: Dream's older sister Death. She is depicted as an attractive, down-to-earth young goth girl, very unlike the traditional personification of death, and spends the issue talking Dream out of his brief post-quest depression. ...more",Sequential Art,Three star(s),http://books.toscrape.com/media/cache/35/18/3518d80c6b73f9c76e9713af42b9c8e1.jpg
http://books.toscrape.com/catalogue/the-complete-maus-maus-1-2_62/index.html,3301af038a720587,The Complete Maus (Maus #1-2),£10.64,£10.64,In stock (1 available),"Combined for the first time here are Maus I: A Survivor's Tale and Maus II - the complete story of Vladek Spiegelman and his wife, living and surviving in Hitler's Europe. By addressing the horror of the Holocaust through cartoons, the author captures the everyday reality of fear and is able to explore the guilt, relief and extraordinary sensation of survival - and how the Combined for the first time here are Maus I: A Survivor's Tale and Maus II - the complete story of Vladek Spiegelman and his wife, living and surviving in Hitler's Europe. By addressing the horror of the Holocaust through cartoons, the author captures the everyday reality of fear and is able to explore the guilt, relief and extraordinary sensation of survival - and how the children of survivors are in their own way affected by the trials of their parents. A contemporary classic of immeasurable significance. ...more",Sequential Art,Three star(s),http://books.toscrape.com/media/cache/e5/0f/e50f35f47d84efaa739eff59b3dd4f7c.jpg
http://books.toscrape.com/catalogue/skip-beat-vol-01-skip-beat-1_55/index.html,2ac720f76384c57e,"Skip Beat!, Vol. 01 (Skip Beat! #1)",£42.12,£42.12,In stock (1 available),"Kyoko always thought that Sho, whose family took her in when she was small, was her prince charming. However, when Sho heads for Tokyo to make it big as a musician, Kyoko goes with him and has to quit high school to support his dream. But soon, being in the big city makes Kyoko realize that she has show business ambitions of her own!",Sequential Art,Three star(s),http://books.toscrape.com/media/cache/03/0a/030af2f71cc40b03f7d79a0929ac9c18.jpg
http://books.toscrape.com/catalogue/saga-volume-1-saga-collected-editions-1_48/index.html,4f64568dfefa3ce7,"Saga, Volume 1 (Saga (Collected Editions) #1)",£28.48,£28.48,In stock (1 available),"When two soldiers from opposite sides of a never-ending galactic war fall in love, they risk everything to bring a fragile new life into a dangerous old universe. From bestselling writer Brian K. Vaughan, Saga is the sweeping tale of one young family fighting to find their place in the worlds. Fantasy and science fiction are wed like never before in this sexy, subversive d When two soldiers from opposite sides of a never-ending galactic war fall in love, they risk everything to bring a fragile new life into a dangerous old universe. From bestselling writer Brian K. Vaughan, Saga is the sweeping tale of one young family fighting to find their place in the worlds. Fantasy and science fiction are wed like never before in this sexy, subversive drama for adults. Collects Saga issues #1-6. ...more",Sequential Art,One star(s),http://books.toscrape.com/media/cache/86/01/860132d9f65dd9df2143fb9071a40115.jpg
http://books.toscrape.com/catalogue/rat-queens-vol-1-sass-sorcery-rat-queens-collected-editions-1-5_46/index.html,3cdca3b4a93980f5,"Rat Queens, Vol. 1: Sass & Sorcery (Rat Queens (Collected Editions) #1-5)",£46.96,£46.96,In stock (1 available),"Who are the Rat Queens? A pack of booze-guzzling, death-dealing battle maidens-for-hire, and they're in the business of killing all god's creatures for profit. It's also a darkly comedic sass-and-sorcery series starring Hannah the Rockabilly Elven Mage, Violet the Hipster Dwarven Fighter, Dee the Atheist Human Cleric and Betty the Hippy Smidgen Thief. This modern spin on a Who are the Rat Queens? A pack of booze-guzzling, death-dealing battle maidens-for-hire, and they're in the business of killing all god's creatures for profit. It's also a darkly comedic sass-and-sorcery series starring Hannah the Rockabilly Elven Mage, Violet the Hipster Dwarven Fighter, Dee the Atheist Human Cleric and Betty the Hippy Smidgen Thief. This modern spin on an old school genre is a violent monster-killing epic that is like Buffy meets Tank Girl in a Lord of the Rings world on crack! Collecting Rat Queens #1-5! ...more",Sequential Art,Five star(s),http://books.toscrape.com/media/cache/70/da/70daa09e4ddebe1d60f50720c0b49976.jpg
